17468|9318989|237312|17065|9318989|08|CHIHUAHUA|019|Chihuahua|0001|Chihuahua|IMPULSORA DOSSER SA DE CV|IMPULSORA DOSSER SA DE CV|237312|Construcción de carreteras, puentes y similares|0 a 5 personas|CALLE|24|2119||4|COLONIA|UNIDAD CHIHUAHUA|||31205|3357|024||||2020-11|28.63418752|-106.09385322||PRIVADA|SAN MARTIN|CALLE|BERNARDO OHIGGINS|CALLE|BENJAMIN FRANKLIN|08019237312000531000000000U4
17470|8392234|466112|17066|8392234|09|CIUDAD DE MÉXICO|010|Álvaro Obregón|0001|Álvaro Obregón|TALLER DE REPARACION GLORIA ASOCIADOS|GLORIA ASOCIADOS INGENIERIA SA DE CV|466112|Comercio al por menor de electrodomésticos menores y aparatos de línea blanca|11 a 30 personas|CALLE|CHILPA|106|||COLONIA|ALFONSO XIII|||01460|2150|017||||2019-11|19.37878180|-99.19442798||CALLE|ALFONSO CANO|CALLE|CARLOS DALCI|CALLE|PABLO VERONÉS|09010466112000413000000000U5
17471|8584335|435411|17067|8584335|09|CIUDAD DE MÉXICO|003|Coyoacán|0001|Coyoacán|PROSIC SERVICIOS|PROSIC SERVICIOS SA DE CV|435411|Comercio al por mayor de mobiliario, equipo, y accesorios de cómputo|6 a 10 personas|AVENIDA|DIVISION DEL NORTE|3651|CENTRO COMERCIAL REAL DE COYOACAN|4|COLONIA|PUEBLO SAN PABLO TEPETLAPA|CENTRO COMERCIAL REAL DE COYOACAN|4|04620|0677|008||PROSIC@PROSIC.COM.MX|WWW.PROSIC.COM.MX|2019-11|19.32126382|-99.13899740|CENTRO Y PLAZA COMERCIAL|CALLE|BENITO JUAREZ|CALZADA|CALZADA DE TLALPAN|CALLE|CÁLIZ|09003435411000262000054961M5
17471|8974590|435210|17068|8974590|17|MORELOS|011|Jiutepec|0001|Jiutepec|PROSIC|PROSIC SERVICIOS SA DE CV|435210|Comercio al por mayor de maquinaria y equipo para la construcción y la minería|0 a 5 personas|CALLE|21 ESTE||||CIUDAD INDUSTRIAL|CIUDAD INDUSTRIAL CIVAC|||62578|0103|017|7773195797|||2019-11|18.91245622|-99.17019088||CALLE|36 SUR|CALLE|NINGUNO|CALLE|36 SUR|17011532411000091000054961S3
17471|6757993|611611|17069|6757993|21|PUEBLA|119|San Andrés Cholula|0013|San Bernardino Tlaxcalancingo|ACADEMIA DE PIANO JOSÉ LUIS ARCARAZ|PROSIC SERVICIOS SA DE CV|611611|Escuelas de arte del sector privado|0 a 5 personas|CALLE|PASEO SINFONIA|2|CENTRO Y PLAZA COMERCIAL||FRACCIONAMIENTO|PLAZA OPERA|PLAZA OPERA|12|72830|0565|006||||2016-10|18.99231502|-98.27769735|CENTRO Y PLAZA COMERCIAL|CALLE|VIENTO|CALLE|MADERAS|CALLE|CONCIERTO|21119611611000151000000000U9
17471|9327187|532492|17070|9327187|30|VERACRUZ DE IGNACIO DE LA LLAVE|039|Coatzacoalcos|0001|Coatzacoalcos|PROSIC|PROMOTORA DE SERVICIOS INTEGRALES PARA LA CONSTRUCCION SA DE CV|532492|Alquiler de maquinaria y equipo para mover, levantar y acomodar materiales|11 a 30 personas|CARRETERA|AVENIDA DEL PUENTE|138|||COLONIA|LAS AMERICAS||||0487|064||PROCSISA@PRODIGY.NET.MX|WWW.PROSIC.COM.MX|2020-11|18.13092441|-94.43656009||AVENIDA|TRANSISTMICA COATZACOALCOSMINATITLAN|CALLE|FRANCISCO SARABIA|CALLE|ARGENTINA|30039532492000163000007331S4
