25436|2806114|621113|57653|2806114|17|MORELOS|007|Cuernavaca|0001|Cuernavaca|COLPOSCOPIA DIGITAL|MED PLUS |621113|Consultorios de medicina especializada del sector privado|6 a 10 personas|CALLE|GUSTAVO DIAZ ORDAZ|21|||COLONIA|CANTARRANAS|||62448|1221|008|7773102110|ROCHES14_76@HOTMAIL.COM||2014-12|18.91724069|-99.21975725||AVENIDA|ATLACOMULCO|CALLE|ALTA TENSION|AVENIDA|ATLACOMULCO|17007621113002902000000000U1
25436|6751209|323119|57654|6751209|28|TAMAULIPAS|038|Tampico|0001|Tampico|IMPRECIONES COLOR PLUS|RRG IMPRESION DIGITAL SA DE CV|323119|Impresión de formas continuas y otros impresos|0 a 5 personas|AVENIDA|UNIVERSIDAD|4208||0|COLONIA|LOS PINOS|||89138|0105|036||COLORPLUSTAMPICO@HOTMAIL.COM||2016-10|22.26182053|-97.86120351||CALLE|VENUSTIANO CARRANZA|CALLE|5|CERRADA|CIRCUITO SAN FELIPE|28038323119001371000000000U0
25437|63569|467111|57655|63569|02|BAJA CALIFORNIA|001|Ensenada|0001|Ensenada|MATERIALES ENSENADA||467111|Comercio al por menor en ferreterías y tlapalerías|0 a 5 personas|CALLE|MIRAMAR|485|||COLONIA|ZONA CENTRO|||22800|0717|012|6461782022|||2010-07|31.86631506|-116.62379008||CALLE|CUARTA|AVENIDA|BENITO JUAREZ (QUINTA)|AVENIDA|GASTELUM|02001434211000301000000000U7
25437|73508|467111|57656|73508|02|BAJA CALIFORNIA|004|Tijuana|0001|Tijuana|MATERIALES ENSENADA|MATERIALES ENSENADA SA DE CV|467111|Comercio al por menor en ferreterías y tlapalerías|11 a 30 personas|AVENIDA|PASEO ENSENADA|2335||0|SECCION|JARDINES DEL SOL|||22606|1473|010|6646809101|MATERIALESENSENADA2015@GMAIL.COM||2010-07|32.51533976|-117.11621771||AVENIDA|AVENIDA DE LA LLUVIA|AVENIDA|PARQUE BAJA CALIFORNIA NORTE|CALLE|CALLE DEL CRESTÓN|02004434211001142001000000U8
25438|8093721|461211|57657|8093721|02|BAJA CALIFORNIA|004|Tijuana|0001|Tijuana|LA CAVA DE BARON BALCHE|DINUWA S DE RL DE CV|461211|Comercio al por menor de vinos y licores|0 a 5 personas|AVENIDA|GENERAL ABELARDO L. RODRIGUEZ|2554||3|COLONIA|ZONA URBANA RIO TIJUANA|||22010|3380|026||||2019-11|32.51952194|-117.01105786||BOULEVARD|GENERAL RODOLFO SANCHEZ TABOADA|AVENIDA|PASEO DE LOS HEROES|BOULEVARD|GENERAL RODOLFO SÁNCHEZ TABOADA|02004461211001341000050398M2
25438|8551968|461211|57658|8551968|02|BAJA CALIFORNIA|004|Tijuana|0001|Tijuana|LA CAVA DE BARON BALCHE|DINUWA S DE RL DE CV|461211|Comercio al por menor de vinos y licores|0 a 5 personas|PRIVADA|NINGUNO|2554||3|COLONIA|REVOLUCION|||22015|3361|009||ADM@BARONBALCHE.COM.MX||2019-11|32.51989435|-117.01567369||CALLE|RIO COLORADO|BOULEVARD|GENERAL RODOLFO SANCHEZ TABOADA|CALLE|NINGUNO|02004461211001391000050398S7
