1729|6429312|466211|26111|6429312|05|COAHUILA DE ZARAGOZA|035|Torreón|0001|Torreón|MB SYSTEMS DE MEXICO|MB SYSTEM S DE MEXICO SA DE CV|466211|Comercio al por menor de mobiliario, equipo y accesorios de cómputo|0 a 5 personas|CALLE|CALLE DEL COMETA|890|||FRACCIONAMIENTO|AMPLIACION LA ROSITA|||27250|1789|018|8717321016|||2010-07|25.51203359|-103.40415863||CALLE|PASEO DEL CICLON|CALLE|PASEO VIENTO SUR|CALLE|PALMA|05035466211000181000000000U9
1729|9111194|466211|26112|9111194|05|COAHUILA DE ZARAGOZA|035|Torreón|0001|Torreón|RIVERS SYSTEM VENTA DE ELECTRONICA|RIVERS SYSTEMS SA DE CV|466211|Comercio al por menor de mobiliario, equipo y accesorios de cómputo|0 a 5 personas|BOULEVARD|DIAGONAL DE LAS FUENTES|20||3|COLONIA|LA FUENTE|||27290|2096|001|7135059|||2019-11|25.51598892|-103.41494710||CALLE|CALLE DEL PROFETA|CALLE|CALLE DEL ARCANGEL|CERRADA|SAN JOEL|05035466211001331000000000S9
1729|9329374|561330|26113|9329374|05|COAHUILA DE ZARAGOZA|030|Saltillo|0001|Saltillo|CLOSURE SYSTEM INTERNATIONAL|CLOSURE SYSTEM INTERNATIONAL TECNISERVICIOS |561330|Suministro de personal permanente|0 a 5 personas|CALLE|Indiana|435||0|COLONIA|VALLE SALTILLO|INDUSTRIAL VALLE SALTILLO|435|25100|4823|055||ILDEFONSO.LOPEZFUENTES@CSICLOSURE.COM||2020-11|25.47538519|-100.99652432|ZONA INDUSTRIAL|AVENIDA|Laviana|CALLE|Tercera|CALLE|Valle de Saltillo|05030561330000821000000000U4
1729|7467294|561610|26114|7467294|05|COAHUILA DE ZARAGOZA|030|Saltillo|0001|Saltillo|H & B PRIVATE SEGURITY SYSTEM|H & B PRIVATE SEGURITY SYSTEM SA DE CV|561610|Servicios de investigación y de protección y custodia, excepto mediante monitoreo|31 a 50 personas|PERIFERICO|LUIS ECHEVERRIA|1017||208|FRACCIONAMIENTO|CUMBRES|||25270|2066|028||B.HERRERA@HBSECURITYSYSTEMS.COM.MX||2019-11|25.44359408|-100.98034769||CALLE|CUMBRES|CALLE|MARIANO ABASOLO|CALLE|PERUGIA|05030561610000764000000000U0
1729|241232|811192|26115|241232|05|COAHUILA DE ZARAGOZA|030|Saltillo|0001|Saltillo|CAR WASH SYSTEM||811192|Lavado y lubricado de automóviles y camiones|11 a 30 personas|BOULEVARD|FRANCISCO COSS|148||0|COLONIA|ZONA CENTRO|||25000|0178|013||||2010-07|25.43177575|-100.99340995||CALLE|GENERAL NICOLAS BRAVO|CALLE|MIGUEL HIDALGO|CALLE|RAFAEL CEPEDA|05030811192001303000000000U3
1729|8630921|811219|26116|8630921|05|COAHUILA DE ZARAGOZA|030|Saltillo|0001|Saltillo|INNOVA SYSTEM||811219|Reparación y mantenimiento de otro equipo electrónico y de equipo de precisión|0 a 5 personas|CALLE|MIGUEL HIDALGO|1741|||COLONIA|BELLAVISTA|||25060|0394|009|8445025341|INNOVASYSTEM@GMAIL.COM||2019-11|25.40568525|-101.00714008||CALLE|LICENCIADO MIGUEL CARDENAS|CALLE|SAN LORENZO|CALLE|JOSÉ MARÍA MORELOS|05030811219001131000000000U9
