14223|7154739|621211|7802|7154739|15|MÉXICO                      |058|Nezahualcóyotl|0001|Ciudad Nezahualcóyotl|LAYA DENTAL||621211|Consultorios dentales del sector privado|0 a 5 personas|CALLE|TLALNEPANTLA|236|||COLONIA|GENERAL JOSE VICENTE VILLADA|||57710|1293|001|5540539589|||2019-11|19.38811338|-99.01012175||CALLE|SIFON|CALLE|MARTIN CARRERA|CALLE|SAN ESTEBAN|15058621211011941000000000U5
14223|1982585|722518|7803|1982585|15|MÉXICO                      |104|Tlalnepantla de Baz|0001|Tlalnepantla|CAZUELAS LAYO||722518|Restaurantes que preparan otro tipo de alimentos para llevar|0 a 5 personas|CALLE|ADOLFO LOPEZ MATEOS|14|||COLONIA|SANMIGUEL XOCHIMANGA|||54020|1527|015|5553702254|||2010-07|19.56373993|-99.21601036||PRIVADA|PRIMERA DIAZ ORDAZ|CALLE|LAZARO CARDENAS|PRIVADA|PRIMERA DÍAZ ORDAZ|15104722212007981000000000U5
14223|2355864|722514|7804|2355864|15|MÉXICO                      |070|La Paz|0040|San Isidro|TACOS LAYO||722514|Restaurantes con servicio de preparación de tacos y tortas|0 a 5 personas|CALLE|CRESCENCIO SANCHEZ|10||12|COLONIA|MARIEL|||56516|1391|018||||2014-12|19.33733719|-98.94647948||CALLE|ANTORCHA POPULAR|CALLE|CLARA CORDOBA|CALLE|CRESCENCIO SÁNCHEZ|15070722514000201000000000U7
14231|8879424|237312|7805|8879424|21|PUEBLA|114|Puebla|0001|Heroica Puebla de Zaragoza|GRUCONST|GRUCONST SA DE CV|237312|Construcción de carreteras, puentes y similares|31 a 50 personas|PROLONGACION|14 SUR|6302||9|COLONIA|LOMA LINDA|||72477|5339|038|2227660519|||2019-11|19.00411322|-98.20705894||CALLE|63 A ORIENTE|PRIVADA|63 B ORIENTE|PRIVADA|63 B ORIENTE|21114237312001124000000000U5
14232|6282084|431130|7806|6282084|01|AGUASCALIENTES|002|Asientos|0011|Ciénega Grande|COMERCIALIZADORA MEXICANA DE LEGUMBRES|COMERCIALIZADORA MEXICANA DE LEGUMBRES SA DE CV|431130|Comercio al por mayor de frutas y verduras frescas|11 a 30 personas|CARRETERA|MORELOS|0||0|COLONIA|CIENEGA GRANDE|||20722|0160|021||ESTEHER@DONHUGO.NET||2010-07|22.19670778|-102.01709973||CALLE|NINGUNO|CALLE|NINGUNO|CALLE|NINGUNO|01002431130000012001000138M4
14232|6378124|431130|7807|6378124|21|PUEBLA|004|Acatzingo|0001|Acatzingo de Hidalgo|COMERCIALIZADORA  MEXICANA  DE LEGUMBRES S|COMERCIALIZADORA MEXICANA DE LEGUMBRES SA DE CV|431130|Comercio al por mayor de frutas y verduras frescas|31 a 50 personas|CARRETERA|DESVIACION MEXICO-XALAPA|0|||COLONIA|ACATZINGO|||75150|0228|017||ESTHER@DONHUGO.NET||2010-07|18.97469573|-97.78682434||CALLE|3 SUR|CALLE|FRANCISCO I. MADERO|PRIVADA|NINGUNO|21004431130000014000000138S2
14233|20735|463211|7808|20735|01|AGUASCALIENTES|001|Aguascalientes|0001|Aguascalientes|TIENDA DE ROPA OZIO FT||463211|Comercio al por menor de ropa, excepto de bebé y lencería|0 a 5 personas|CALLE|RIVERO Y GUTIERREZ||CENTRO Y PLAZA COMERCIAL|15|COLONIA|ZONA CENTRO|CENTRO COMERCIAL EL PARIAN|15|20000|0638|009||||2010-07|21.88350828|-102.29571927|CENTRO Y PLAZA COMERCIAL|PEATONAL|BENITO JUAREZ|CALLE|JOSE MARIA MORELOS Y PAVON|PEATONAL|ALLENDE ORIENTE|01001463211008071000000000U3
14233|8301253|713943|7809|8301253|02|BAJA CALIFORNIA|001|Ensenada|0001|Ensenada|HEROES FT||713943|Centros de acondicionamiento físico del sector privado|0 a 5 personas|CALLE|HUERTA|136||4|FRACCIONAMIENTO|ADOLFO RUIZ CORTINES|||22785|9602|019||||2019-11|31.81451930|-116.59698865||CARRETERA|TRANSPENINSULAR (REFORMA)|BOULEVARD|ZERTUCHE|AVENIDA|GENERAL VENUSTIANO CARRANZA|02001713943002281000000000U9
