17545|1884538|435319|17145|1884538|14|JALISCO|039|Guadalajara|0001|Guadalajara|GRUPO ALBANDI|GRUPO ALBANDI SA DE CV|435319|Comercio al por mayor de maquinaria y equipo para otros servicios y para actividades comerciales|6 a 10 personas|CALZADA|INDEPENDENCIA NORTE|1071|||COLONIA|INDEPENDENCIA|||49280|0736|012||PBETOS@PRODIGY.NET.MX|WWW.PLASTICOSBETOS.COM|2010-07|20.69128485|-103.33333547||CALLE|SILVESTRE REVUELTAS|CALLE|GONZALO CURIEL|CALLE|MONTE DE LAS ÁNIMAS|14039435319002732000000000U7
17546|1851666|463216|17146|1851666|14|JALISCO|039|Guadalajara|0001|Guadalajara|BOLSAS FLORENTIAN|FLORENTAN SA DE CV|463216|Comercio al por menor de ropa de cuero y piel y de otros artículos de estos materiales|0 a 5 personas|CALLE|ALVARO OBREGON|234|||COLONIA|SAN JUAN DE DIOS|||44360|1378|036||||2010-07|20.67359992|-103.33842726||CALLE|CABAÑAS|CALLE|VICENTE GUERRERO|CALLE|GIGANTES EJE|14039463216001731000000000U3
17546|9209682|465912|17147|9209682|14|JALISCO|039|Guadalajara|0001|Guadalajara|FLORENTIAN|FLORENTIAN SA DE CV|465912|Comercio al por menor de regalos|0 a 5 personas|CALLE|ALVARO OBREGON|185|||COLONIA|SAN JUAN DE DIOS|||44360|1378|029||||2019-11|20.67388582|-103.33905206||CALLE|J. ANTONIO TORRES|CALLE|CABAÑAS|AVENIDA|JAVIER MINA|14039465912018041000000000U0
17546|8691011|466319|17148|8691011|14|JALISCO|039|Guadalajara|0001|Guadalajara|FLORES ARTIFICALES FLORENTIAN|FLORENTIAN SA DE CV|466319|Comercio al por menor de otros artículos para la decoración de interiores|0 a 5 personas|CALLE|ALVARO OBREGON|328|||COLONIA|SAN JUAN DE DIOS|||44360|1378|034||||2019-11|20.67302872|-103.33645121||CALLE|MARIANO JIMENEZ|CALLE|ABASCAL Y SOUZA|CALLE|GIGANTES EJE|14039466319003081000000000U0
17546|6711795|463211|17149|6711795|14|JALISCO|039|Guadalajara|0001|Guadalajara|ROPA PARA DAMA FLORENTIAN|FLORENTIAN SA DE CV|463211|Comercio al por menor de ropa, excepto de bebé y lencería|0 a 5 personas|CALLE|ALVARO OBREGON|159|||COLONIA|CENTRO|||44360|1378|029|013336176915|VENTAS@FELIANA.COM.MX|WWW.FELIANNA.COM|2016-01|20.67460888|-103.33885830||CALLE|J. ANTONIO TORRES|CALLE|CABAÑAS|AVENIDA|JAVIER MINA|14039463211045591000000000U0
17549|8991134|322210|17150|8991134|14|JALISCO|120|Zapopan|0231|Tesistán (San Francisco Tesistán)|CORRCRAFT|CORRCRAFT SA DE CV|322210|Fabricación de envases de cartón|31 a 50 personas|PRIVADA|ARROYO TESISTAN|500|||COLONIA|TESISTAN|||45200|3842|002||||2019-11|20.79391396|-103.48170346||CALLE|JALISCO|CALLE|ANTIGUO CAMINO A TESISTAN|CALLE|JALISCO|14120322210000614000000000U4
