6075|743598|468211|34736|743598|09|CIUDAD DE MÉXICO|007|Iztapalapa|0001|Iztapalapa|VHM ELECTRONICA AUTOMOTRIZ SA DE CV|BHM ELÉCTRICA AUTOMOTRIZ |468211|Comercio al por menor de partes y refacciones nuevas para automóviles, camionetas y camiones|0 a 5 personas|EJE VIAL|5 ORIENTE (AVENIDA JAVIER ROJO GOMEZ)|559|||COLONIA|ALFONSO ORTIZ TIRADO|||09020|2390|026||||2010-07|19.38582685|-99.07545637||EJE VIAL|4 SUR (SAN RAFAEL ATLIXCO)|CALLE|PLAZA GUARDIOLA|CALLE|PLAZA CUAJOMULCO|09007468211006381000000000U2
6075|6147040|237111|34737|6147040|15|MÉXICO                      |106|Toluca|0001|Toluca de Lerdo|VHM   CONSTRUCTORES S DE RL CV|VHM CONSTRUCTORES SC DE RL DE CV|237111|Construcción de obras para el tratamiento, distribución y suministro de agua y drenaje|11 a 30 personas|CALLE|BAJADA DE LOS ÁLAMOS|107||0|COLONIA|ZOPILOCALCO|||50050|0330|032||||2010-07|19.29596289|-99.65090134||CALLE|BAJADA DE LOS ALAMOS|CALLE|PASEO DE LOS MATLAZINCAS (PASEO TOLLOCAN NORTE)|CALLE|PASEO DE LOS MATLAZINCAS (PASEO TOLLOCAN NORTE)|15106236221000131011000000U9
6077|6234024|621511|34738|6234024|15|MÉXICO                      |054|Metepec|0049|San Salvador Tizatlalli|54 LABORATORIO MEDICO DEL CHOPO METEPEC LAS MARINAS|GRUPO DIAGNOSTICO MEDICO PROA SA DE CV|621511|Laboratorios médicos y de diagnóstico del sector privado|0 a 5 personas|AVENIDA|MANUEL J. CLOUTHIER|1700||0|COLONIA|LAS MARINAS|||52176|1133|038||JUANBRAVO@PROA.COM.MX|WWW.CHOPO.COM.MX|2010-07|19.27526865|-99.59372493||PRIVADA|19|CALLE|5|OTRO (ESPECIFIQUE)|99|15054621511000091002003549S4
6077|6234410|621511|34739|6234410|15|MÉXICO                      |054|Metepec|0034|San Francisco Coaxusco|55 LABORATORIO MEDICO DEL CHOPO METEPEC GALERIAS|GRUPO DIAGNOSTICO MEDICO PROA SA DE CV|621511|Laboratorios médicos y de diagnóstico del sector privado|11 a 30 personas|CALLE|LEONA VICARIO|703||0|COLONIA|LA PURISIMA|||52140|0883|003||JUANBRAVO@PROA.COM.MX|WWW.CHOPO.COM.MX|2010-07|19.26144331|-99.62327648||CALLE|REAL DE ARCOS|CALLE|ESTEFANIAS|AVENIDA|LIC. BENITO JUAREZ GARCIA|15054621511000051002003549S8
6077|6208801|621511|34740|6208801|15|MÉXICO                      |106|Toluca|0001|Toluca de Lerdo|LABORATORIO MEDICO METEPEC|LABORATORIO MEDICO METEPEC |621511|Laboratorios médicos y de diagnóstico del sector privado|11 a 30 personas|AVENIDA|5 DE MAYO|820|||COLONIA|VALLE DON CAMILO|EDIFICIO 5 DE MAYO||50150|2430|018|7222123030|||2010-07|19.27611320|-99.63583568|EDIFICIO COMERCIAL Y DE SERVICIOS|CALLE|MONTE BLANCO|CALLE|MONTE EVEREST|CALLE|MONTES ALTAI|15106621511000623000000000U2
6078|6157732|484129|34741|6157732|15|MÉXICO                      |054|Metepec|0101|Residencial Campestre Metepec|AUTOEXPRESS JAMA|AUTOEXPRESS JAMA SA DE CV|484129|Otro autotransporte foráneo de carga general|31 a 50 personas|CALLE|CAMINO A SANTA MARIA OCOTITLAN|0|||COLONIA|SAN LORENZO COACALCO|||52140|0309|800|7223732732|||2014-12|19.23703268|-99.60215306||CARRETERA|TOLUCA TENANGO|CARRETERA|METEPEC ZACANGO|CALLE|SAN BARTOLO|15054484129000134000000000U9
