17559|8638534|811112|17158|8638534|07|CHIAPAS|078|San Cristóbal de las Casas|0001|San Cristóbal de las Casas|AUTO ELECTRICO 11 CUARTOS||811112|Reparación del sistema eléctrico de automóviles y camiones|0 a 5 personas|CALLE|MIGUEL DE CERVANTES|12|||COLONIA|11 CUARTOS|||29243|0645|035||||2019-11|16.74369614|-92.65222205||CALLE|RUBEN DARIO|CALLE|9 DE ENERO|AVENIDA|SAUCES|07078811112000541000000000U4
17559|472960|811192|17159|472960|07|CHIAPAS|101|Tuxtla Gutiérrez|0001|Tuxtla Gutiérrez|LAVADO DE AUTOS LA TROCA 11||811192|Lavado y lubricado de automóviles y camiones|6 a 10 personas|CALLE|CARRETERA A VILLAFLORES|1932|||BARRIO|SAN FRANACISCO|||29049|1107|020||||2010-07|16.73805514|-93.11299420||AVENIDA|DECIMA NOVENA SUR ORIENTE|AVENIDA|DECIMA OCTAVA SUR ORIENTE|CALLE|QUINTA ORIENTE SUR|07101811192000191001000000U0
17559|1060650|811121|17160|1060650|09|CIUDAD DE MÉXICO|012|Tlalpan|0001|Tlalpan|AUTO 11-11|AUTO 11-11 SA DE CV|811121|Hojalatería y pintura de automóviles y camiones|11 a 30 personas|CALLE|SAN JUAN BOSCO|21|||COLONIA|AVENIDA ACUEDUCTO|||14370|0445|004||||2010-07|19.29752440|-99.14978085||CALZADA|ACUEDUCTO|CALLE|RESPALDO DE SAN LORENZO|CALLE|SAN JUAN DE DIOS|09012811121001443000000000U0
17559|3255140|468211|17161|3255140|21|PUEBLA|114|Puebla|0001|Heroica Puebla de Zaragoza|AUTO MAX 11||468211|Comercio al por menor de partes y refacciones nuevas para automóviles, camionetas y camiones|0 a 5 personas|CALLE|21 NORTE|4603|||COLONIA|CLEOTILDE TORRES|||72040|0130|024|2222202221|||2010-07|19.06931128|-98.19951981||OTRO (ESPECIFIQUE)|NINGUNO|OTRO (ESPECIFIQUE)|NINGUNO|OTRO (ESPECIFIQUE)|NINGUNO|21114468211005712000000000S7
17559|8214615|811192|17162|8214615|21|PUEBLA|114|Puebla|0001|Heroica Puebla de Zaragoza|AUTO LAVADO 11 CLUB||811192|Lavado y lubricado de automóviles y camiones|0 a 5 personas|BOULEVARD|PROLONGACION 11 SUR|7902|||COLONIA|SAN JOSE MAYORAZGO|||72450|1514|053||||2019-11|19.00946806|-98.23542906||AVENIDA|79 PONIENTE|AVENIDA|81 PONIENTE|PRIVADA|15 C SUR|21114811192008761000000000U7
17561|6143499|237312|17163|6143499|07|CHIAPAS|101|Tuxtla Gutiérrez|0001|Tuxtla Gutiérrez|COMERCIALIZADORA Y CONSTRUCTORA DEL SURESTE SA DE CV|COMERCIALIZADORA Y CONSTRUCTORA DEL SURESTE SA DE CV|237312|Construcción de carreteras, puentes y similares|11 a 30 personas|AVENIDA|ROSA DEL SUR|216||0|FRACCIONAMIENTO|FRACCIONAMIENTO EL BOSQUE||||1681|001||CYCSUR94@HOTMAIL.COM||2010-07|16.76417414|-93.08923375||CALLE|ROBLE|CALLE|NINGUNO|AVENIDA|PRIMAVERA|07101237312000893000000000U1
17564|8387586|484129|17164|8387586|01|AGUASCALIENTES|005|Jesús María|0507|Parque Industrial del Valle de Aguascalientes (PIVA)|COMPAÑIA DE TRANSPORTE DE CARGA EN MEXICO TNL EXPRESS|TNL EXPRESS SA DE CV|484129|Otro autotransporte foráneo de carga general|11 a 30 personas|CIRCUITO|AGUASCALIENTES NORTE|149|||CIUDAD INDUSTRIAL|JESUS MARIA|||20350|0035|004||JQUEZADA@TNL.COM.MX|WWW.TNL.MX|2019-11|21.96715916|-102.28815812||CIRCUITO|AGUASCALIENTES NORTE|CIRCUITO|AGUASCALIENTES NORTE|AVENIDA|SIN REFERENCIA|01005484129000323000015657S6
