17439|6883736|332710|17052|6883736|02|BAJA CALIFORNIA|002|Mexicali|0001|Mexicali|G & H MANUFACTURING, S. DE R.L. DE C.V.|G & H MANUFACTURING S DE RL DE CV|332710|Maquinado de piezas metálicas para maquinaria y equipo en general|31 a 50 personas|BOULEVARD|LAZARO CARDENAS|4530||0|EJIDO|ISLAS AGRARIAS A|||21600|6728|025||CONTABILIDAD1@GRUPOMETALCO.COM||2019-04|32.58553125|-115.34924920||AVENIDA|SANIDINA|CALLE|NINGUNO|CALLE|NINGUNO|02002332710001013001000000U9
17439|6908610|336999|17053|6908610|02|BAJA CALIFORNIA|001|Ensenada|0001|Ensenada|G FAB WORKS||336999|Fabricación de otro equipo de transporte|0 a 5 personas|AVENIDA|GASTELUM|1557|||COLONIA|ZONA CENTRO|||22800|0577|015|6461622523|GFABWORKS.ENS@GMAIL.COM||2019-11|31.87816944|-116.61914003||CALLE|16|CALLE|15|AVENIDA|RUÍZ|02001336999000041000000000U8
17439|6776993|336210|17054|6776993|02|BAJA CALIFORNIA|004|Tijuana|0001|Tijuana|G LUZ DE MEXICO SA DE CV|G LUZ DE MEXICO SA DE CV|336210|Fabricación de carrocerías y remolques|101 a 250 personas|CALLE|VALLE DEL SUR|8761||0|COLONIA|VALLE SUR|||22637|1774|034||EDECONTANDO3@GMAIL.COM||2017-03|32.46692192|-116.91314463||CALLE|CEDROS|CALLE|PERIFÉRICO (LIBRAMIENTO SUR)|CALLE|PERIFÉRICO (LIBRAMIENTO SUR)|02004336210000143001000000U8
17440|6761397|434221|17055|6761397|09|CIUDAD DE MÉXICO|005|Gustavo A. Madero|0001|Gustavo A. Madero|FERREACEROS LA PAZ|FERREACEROS LA PAZ SA DE CV|434221|Comercio al por mayor de materiales metálicos para la construcción y la manufactura|6 a 10 personas|EJE VIAL|1 PONIENTE (CALZADA VALLEJO)|1718|||COLONIA|PROGRESO NACIONAL|||07600|0436|031||||2016-10|19.52209372|-99.16492931||CALLE|PROGRESO NACIONAL|CALLE|1|CALLE|PROGRESO NACIONAL|09005434221000931001049679M4
17440|6736528|467111|17056|6736528|09|CIUDAD DE MÉXICO|005|Gustavo A. Madero|0001|Gustavo A. Madero|FERREACEROS LA PAZ|FERREACEROS LA PAZ SA DE CV|467111|Comercio al por menor en ferreterías y tlapalerías|0 a 5 personas|EJE VIAL|CENTRAL (LAZARO CARDENAS)|3097|||COLONIA|GUADALUPE PROLETARIA|||07500|0385|022||||2016-10|19.52311069|-99.15801694||CALLE|11|CALLE|12|CALLE|L. OLVERA|09005467111010371000049679S4
17443|6294672|488111|17057|6294672|08|CHIHUAHUA|019|Chihuahua|1067|Santa Lucía|AEROPUERTO INTERNACIONAL ROBERTO FIERRO VILLALOBOS|SERVICIOS A LA NAVEGACION EN EL ESPACIO AEREO MÉXICANO |488111|Servicios a la navegación aérea|0 a 5 personas|BOULEVARD|JUAN PABLO II KM||||AEROPUERTO|ROBERTO FIERRO VILLALOBOS|AEROPUERTO INTERNACIONAL ROBERTO FIERRO V|SN|31389|4478|800||SENEAM_CUU@SCT.GOB.MX|WWW.SENEAM.GOB.MX|2010-07|28.70418000|-105.96951000|AEROPUERTO|CALLE|NINGUNO|CALLE|NINGUNO|CALLE|NINGUNO|08019488111000021000002344S4
17447|4052803|461110|17058|4052803|28|TAMAULIPAS|032|Reynosa|0001|Reynosa|TORTILLAS GONZALEZ MALESA||461110|Comercio al por menor en tiendas de abarrotes, ultramarinos y misceláneas|0 a 5 personas|CALLE|LA SIERRA|300|||COLONIA|LA CIMA|||88710|3233|015||||2014-12|26.07527172|-98.34603895||OTRO (ESPECIFIQUE)|NINGUNO|OTRO (ESPECIFIQUE)|NINGUNO|OTRO (ESPECIFIQUE)|NINGUNO|28032461110035111000000000U4
17447|4383283|463310|17059|4383283|30|VERACRUZ DE IGNACIO DE LA LLAVE|108|Minatitlán|0001|Minatitlán|ZAPATERIA MALESA||463310|Comercio al por menor de calzado|0 a 5 personas|CALLE|SEBASTIAN LERDO DE TEJADA|28|||COLONIA|CENTRO|||96700|1380|014||||2010-07|17.98346518|-94.54462779||CALLE|MANUEL RODRIGUEZ OLAN|CALLE|ESTIBADORES|CALLE|AMELIA RIVEROL|30108463310000951000000000U2
17452|612393|465111|17060|612393|08|CHIHUAHUA|019|Chihuahua|0001|Chihuahua|BELLISIMA|MARGLI SA DE CV|465111|Comercio al por menor de artículos de perfumería y cosméticos|0 a 5 personas|AVENIDA|MELCHOR OCAMPO|204|||COLONIA|SANTA RITA|||31000|3376|034||||2010-07|28.63476081|-106.07853695||CALLE|VICTORIA|CALLE|LIBERTAD|CALLE|DUODÉCIMA|08019463214000132010000000U0
