6057|4250155|464113|34726|4250155|30|VERACRUZ DE IGNACIO DE LA LLAVE|131|Poza Rica de Hidalgo|0001|Poza Rica de Hidalgo|OXYNET||464113|Comercio al por menor de productos naturistas, medicamentos homeopáticos y de complementos alimenticios|0 a 5 personas|CALLE|8 ORIENTE|57||5|COLONIA|OBRERA|||93260|0234|028||DAVIDJUAREZ1954@HOTMAIL.COM|WWW.OXYNET.COM|2014-12|20.52778715|-97.46120220||CALLE|4 NORTE|CALLE|6 NORTE|CALLE|10 ORIENTE|30131812110005351010000000U4
6057|7701304|464111|34727|7701304|30|VERACRUZ DE IGNACIO DE LA LLAVE|189|Tuxpan|0001|Túxpam de Rodríguez Cano|PRODUCTOS NATURALES OXYNET||464111|Farmacias sin minisúper|0 a 5 personas|CALLE|GENERAL PRIM|2|||COLONIA|CENTRO|||92800|0215|003|7835817001|||2019-11|20.95232379|-97.40083630||CALLE|VICENTE GUERRERO|CALLE|GENARO RODRIGUEZ|CALLE|NIÑO ARTILLERO|30189464111000661000000000U8
6058|6231798|811312|34728|6231798|05|COAHUILA DE ZARAGOZA|035|Torreón|0001|Torreón|SESA|SYSTEM OF ENERGY SA DE CV|811312|Reparación y mantenimiento de maquinaria y equipo industrial|31 a 50 personas|AVENIDA|TERCERA|1675||0|COLONIA|EDUARDO GUERRA|||27280|1774|023||RECURSOSHUMANOS-SESA@GAMIL.COM||2010-07|25.51813045|-103.42261390||CALLE|O|CALLE|P|AVENIDA|SEGUNDA|05035811312001155001000000U0
6059|9248303|484239|34729|9248303|28|TAMAULIPAS|022|Matamoros|0001|Heroica Matamoros|RS TRASFER|RS TRANSFER SA DE CV|484239|Otro autotransporte foráneo de carga especializado|0 a 5 personas|CALLE|PRIMERA|1207|||COLONIA|CENTRO|||87300|1141|034||||2020-04|25.88226213|-97.49953520||CALLE|MANUEL GONZALEZ|CALLE|MARIANO ABASOLO|CALLE|5 DE MAYO|28022484239000201000015684S5
6062|278621|332320|34730|278621|05|COAHUILA DE ZARAGOZA|035|Torreón|0001|Torreón|TALLER DE PRODUCCION DE ESTRUCTURAS METALICAS FEREY|TALLER FIREY SA DE CV|332320|Fabricación de productos de herrería|11 a 30 personas|PRIVADA|NINGUNO||||COLONIA|NUEVA LAGUNA NORTE|||27000|3291|009||FIREY_SADECV@HOTMAIL.COM||2014-12|25.58845353|-103.41781168||CALLE|ÁVILA CAMACHO|PRIVADA|NINGUNO|CALLE|ÁVILA CAMACHO|05035332320004572001000000U6
6063|7559382|813230|34731|7559382|15|MÉXICO                      |031|Chimalhuacán|0001|Chimalhuacán|GRUPO DE ATENCION CIUDADANA ECLIPSE GACE||813230|Asociaciones y organizaciones civiles|0 a 5 personas|AVENIDA|IGNACIO MANUEL ALTAMIRANO|10||0|BARRIO|CESTEROS|||56367|0376|046||||2019-11|19.44487567|-98.95802812||CALLE|TEOYOLQUIMA|AVENIDA|EJIDO COLECTIVO|CALLE|ECATL|15031813230000541000000000U1
