Index,Nombre1,Nombre2,Nombre3,Direccion1,Direccion2,Direccion3,Colonia,MunicipioDel,CP,EntreCalle1,EntreCalle2,Estado,NombComp
493,PSI PINTURAS SA DE C,V,,ALTA TENSION,16,,VICENTE ESTRADA CAJIGAL,CUERNAVACA,62460,VIOLETA,GERANIOS,Morelos,PSI PINTURAS  SA DE CV
494,SERVICIOS DE CALIDAD,EN LOGISTICA SA DE,CV,35 SUR,2702 B,303,STA CRUZ LOS ANGELES,PUEBLA,72400,33 SUR,27 PTE,Puebla,SERVICIOS DE CALIDADEN LOGISTICA  SA DE CV
495,VALVULAS DE ORIENTE,SA DE CV,,CITLALTEPETL,2508,,LOS VOLCANES,PUEBLA,72410,25 PONIENTE,27 PONIENTE,Puebla,VALVULAS DE ORIENTE  SA DE CV
496,"ITALCER,SA DE CV",,,CALZ ZAVALETA,5622,,CONCEPCION LA CRUZ,PUEBLA,72197,BOULEVARD ATLIXCO,PRIVADA 51 SUR,Puebla,"ITALCER, SA DE CV"
497,COMERCIO Y SERVICIOS,ANGY  SA DE CV,,JALISCO,701,2,POPULAR EMILIANO ZAPATA,PUEBLA,72470,,,Puebla,COMERCIO Y SERVICIOSANGY  SA DE CV
498,PROMOTORA Y TRANSFOR,MADORA DE ENERGIA# S,#A# DE C#V#,DR ANGEL MARTINEZ VILLARREAL,550,,CHEPEVERA,MONTERREY,64030,,,Nuevo Leon,PROMOTORA Y TRANSFORMADORA DE ENERGIA  SA DE CV
499,MANLO REFACCIONES Y,CONSUMIBLES SA DE CV,,GUERRERO,302,########,A#O DE JUAREZ FOMERR,SAN NICOLAS DE LOS GARZA,66460,LAZARO CARDENAS,NOPAL,Nuevo Leon,MANLO REFACCIONES Y CONSUMIBLES  SA DE CV
500,PROYECTOS Y CONSTRUC,CIONES COPASA SA DE,CV,ANILLO PERIFERICO,628,,COLINAS DE SAN JERON,MONTERREY,64630,ANTONIO CASO,CAM A LOS NANDU,Nuevo Leon,PROYECTOS Y CONSTRUCCIONES COPASA  SA DE CV
501,EMPRESA MUNDIAL MEXI,CANA SA DE CV,,FAMA,354,,EL MILAGRO,APODACA,66634,REYNALDO SANCHEZ,JOSE JULIAN GARCIA,Nuevo Leon,EMPRESA MUNDIAL MEXICANA  SA DE CV
502,DISPOSITIVOS Y MAQUI,NADOS INDUSTRIALES S,A DE CV,OCAMPO,540,,APODACA CENTRO,APODACA,66600,,,Nuevo Leon,DISPOSITIVOS Y MAQUINADOS INDUSTRIALES  SA DE CV
503,FLY PRODUCCIONES SA,DE CV,,BLV ACAPULCO,3940,,VALLE DE LAS BRISAS,MONTERREY,64790,,,Nuevo Leon,FLY PRODUCCIONES  SA DE CV
504,VENTA VET SA DE CV,,,AV LAZARO CARDENAS,2909,L3,VALLE DEL MARQUEZ FO,MONTERREY,64790,UNO,DOS,Nuevo Leon,VENTA VET  SA DE CV
505,AG GRUPO FARMACEUTIC,O SA DE CV,,AV OBSIDIANA,2489,,RESIDENCIAL VICTORIA,GUADALAJARA,44560,ONIX,AGUAMARINA,Jalisco,AG GRUPO FARMACEUTICO  SA DE CV
506,SMART INFORMATION NE,T S DE RL DE CV,,POCITO,100,,CIUDAD DEL SOL,ZAPOPAN,45050,,,Jalisco,SMART INFORMATION NET S DE RL DE CV
507,TRANSPORTES DE CARGA,MEXICANA SA DE CV,,GONZALEZ GALLO,1820,,ATLAS,GUADALAJARA,44870,RIO LA BARCA,RIO TIZAPAN,Jalisco,TRANSPORTES DE CARGAMEXICANA  SA DE CV
508,PROMOCIONES BIOGENET,ICAS#SA DE CV,,CUAUTITLAN,679,A,CHAPALITA,GUADALAJARA,44510,AV# GUADALUPE,AV# LAZARO CARDENAS,Jalisco,PROMOCIONES BIOGENETICAS SA DE CV
509,MUEBLERA LAMIN  SA D,E CV,,CONSTITUYENTES,1032,,CONSTITUCION,ZAPOPAN,45180,NICOLAS,BELENES,Jalisco,MUEBLERA LAMIN  SA DE CV
510,"INMECA BUSTERS,SA DE",CV,,SEBASTIAN BACH,5022,,PRADOS GUADALUPE,ZAPOPAN,45030,AV PATRIA,GOYA,Jalisco,"INMECA BUSTERS, SA DE CV"
511,"GRUPO RIEGO,SA DE CV",,,LAZARO CARDENAS,13,,ATLACOMULCO,JIUTEPEC,62560,AV CHAPULTEPEC,EMILIANO ZAPATA,Morelos,"GRUPO RIEGO, SA DE CV"
512,COMERCIA I.S. SA DE,CV,,BOULEVARD BENITO JUAREZ,103,6,LAS PALMAS,CUERNAVACA,62050,UNO,DOS,Morelos,COMERCIA I.S.  SA DE CV
513,AGRICOLA BARRAGAN SA,DE CV,,CENTRAL DE ABASTOS NAVE C,BOD 13,,TETELCINGO,CUAUTLA,62757,CALLE,CALLE,Morelos,AGRICOLA BARRAGAN SA DE CV
514,"MADERERIA SAMANIEGO,",SA DE CV,,CALLE H Y MARMOLEROS,1600,,INDUSTRIAL,MEXICALI,21010,UNO,DOS,Baja California,"MADERERIA SAMANIEGO, SA DE CV"
515,GRUPO AMERICANO SA D,E CV,,CALLE PRIMERA Y A,94,,LOS ALGODONES,MEXICALI,21970,MARIANO MA LEE,SEGUNDA,Baja California,GRUPO AMERICANO  SA DE CV
516,HAVEL CONSTRUCCIONES,SA DE CV,,SUR 105,706,2,SECTOR POPULAR,IZTAPALAPA,9060,,,CDMX,HAVEL CONSTRUCCIONES SA DE CV
517,MOTELES RESORTS LION,S  SA DE CV,,GUADALUPE POSADAS,44,,STA CATARINA AMPLI,VALLE DE CHALCO SOLIDARIDAD,56619,EJE 10 SUR,ACAPOL,Estado de Mexico,MOTELES RESORTS LIONS  SA DE CV
518,MOTEL AQUARIUS SA DE,CV,,AUTOPISTA  MEX PUEBLA KM 27,508,1,SAN ISIDRO,VALLE DE CHALCO SOLIDARIDAD,56617,PONIENTE 15,NORTE 14,Estado de Mexico,MOTEL AQUARIUS SA DE CV
519,PAPELERA TORREFUERTE,SA DE CV,,PRIV HIDALGO,1 B,,TLALNEPANTLA CENTRO,TLALNEPANTLA,54000,AVE,,Estado de Mexico,PAPELERA TORREFUERTE SA DE CV
520,COMERCIAL PAPELERA T,ENAYUCA#SA DE CV,,ZACATECAS,26,1,VALLE CEYLAN,TLALNEPANTLA,54150,HERMOSILLO,CHIHUAHUA,Estado de Mexico,COMERCIAL PAPELERA TENAYUCA SA DE CV
521,IMPORT SOLUTION SA D,E CV,,NTE 17,135,1,MOCTEZUMA 2A SECCION,VENUSTIANO CARRANZA,15530,OTE 150,OTE 152,CDMX,IMPORT SOLUTION  SA DE CV
522,MEX TELECOM SA DE CV,,,LOPEZ,40,B,CENTRO #AREA 1#,CUAUHTEMOC,6000,ART 123,VICTORIA,CDMX,MEX TELECOM  SA DE CV
523,AVILA SPORT SA DE CV,,,PRIV PATRIOTISMO,75,201,ESCANDON I SECCION,MIGUEL HIDALGO,11800,PROGRESO,MARTI,CDMX,AVILA SPORT  SA DE CV
524,ZUMSAN SA DE CV,,,CALLE MESONES,37,LOC A,CENTRO AREA 8,CUAUHTEMOC,6080,CALLE ISABEL LA CATOLICA,SIMON BOLIVAR,CDMX,ZUMSAN  SA DE CV
525,COMERCIALIZADORA SET,COMPUTERS SA DE CV,,LAZARO CARDENAS,38,12,CENTRO AREA 1,CUAUHTEMOC,6000,BOLIVAR,REPUBLICA DE URUGUAY,CDMX,COMERCIALIZADORA SETCOMPUTERS  SA DE CV
526,ANFA TECNOLOGY STORE,SA DE CV,,C REP DE URUGUAY,14LOC 1A,,CENTRO AREA 1,CUAUHTEMOC,6000,REP DE EL SALVADOR,VENUSTIANO CARRANZA,CDMX,ANFA TECNOLOGY STORE SA DE CV
527,DANROM SA DE CV,,,AV TAMAULIPAS,150,1301 B,CONDESA,CUAUHTEMOC,6140,XOCHICALCO,AV DOC JOSE MA VERTIZ,CDMX,DANROM  SA DE CV
528,GRUPO NETFIRE SA DE,CV,,NUEVO LEON,95,PISO 3,HIPODROMO CONDESA,CUAUHTEMOC,6170,INSURGENTES,MICHOACAN,CDMX,GRUPO NETFIRE  SA DE CV
529,BUSINESS SOLUTIONS A,ND MR S DE RL DE CV,,CIRCUNVALACION DIVISION DEL NORTE,1504,,JARDINES DEL COUNTRY,GUADALAJARA,44210,AVE,AVE,Jalisco,BUSINESS SOLUTIONS AND MR S DE RL DE CV
530,GRUPO DE CONSULTORES,EN DESARROLLOS DE N,EGOCIOS SA DE CV,PRAGA,24,PISO 2,JUAREZ,CUAUHTEMOC,6600,UNO,DOS,CDMX,GRUPO DE CONSULTORESEN DESARROLLOS DE N EGOCIOS  SA DE CV
531,SERVICIOS ASESORIA Y,TRAMITACION R#R SA,DE CV,AV 16 DE SEPTIEMBRE,2,P ALTA,HIDALGO,NICOLAS ROMERO,54434,AV HIDALGO,15 DE SEPTIEMBRE,Estado de Mexico,SERVICIOS ASESORIA YTRAMITACION RR  SA DE CV
532,IMPRESION ARTE PUBLI,CIDAD#SA DE CV,,BERNAL DIAZ DEL CASTILLO,9,,CIUDAD SATELITE,NAUCALPAN,53100,1,2,Estado de Mexico,IMPRESION ARTE PUBLICIDAD SA DE CV
533,DESARROLLOS SOLARES,ARANDAS SA DE CV,,CAMINO AL GALLITO,920,,ARANDAS CENTRO,ARANDAS,47180,CAM,AL GALLITO,Jalisco,DESARROLLOS SOLARES ARANDAS  SA DE CV
534,AGRO NIJELSA SPR DE,RL DE CV,,HIDALGO,359,,PALOS ALTOS,IXTLAHUACAN DEL RIO,45270,JOSE HDEZ RIVAZ,CONOCIDO,Jalisco,AGRO NIJELSA SPR DE RL DE CV
535,TRANSPORTES REAL DE,MINAS#SA DE CV,,2A DE JUAN DE TOLOSA,22,,BENITO JUAREZ,FRESNILLO,99020,LOS,PRADOS,Zacatecas,TRANSPORTES REAL DE MINAS SA DE CV
536,DINAMICA COMPUTACION,AL DE AGUASCALIENTES,S#A# DE C#V#,JARDINES ETERNOS,210,1,LA CONCORDIA,AGUASCALIENTES,20040,MA CONCEPCION MALDONADO,MONTEBELLO,Aguascalientes,DINAMICA COMPUTACIONAL DE AGUASCALIENTES SA DE CV
537,BUFFET DE INGENIERIA,EN TELECOMUNICACION,ES SA DE CV,AVENIDA HEROE DE NACOZARI NORTE,104,,LA PURISIMA,AGUASCALIENTES,20259,ALAMEDA,J REFUGIO REYES,Aguascalientes,BUFFET DE INGENIERIAEN TELECOMUNICACION ES  SA DE CV
538,CORPORATIVO KALED S,DE RL DE CV,,FLORES,404,,HERIBERTO KEHOE VICE,CENTRO,86030,UNO,DOS,Tabasco,CORPORATIVO KALED S DE RL DE CV
539,CRUSTACEOS CONGELADO,S SA DE CV,,CALLE SIN NOMBRE,LOTE1Y2,,LERMA,CAMPECHE,24500,CALLE SN,AVENIDA UNO ORIENTE,Campeche,CRUSTACEOS CONGELADOS  SA DE CV
540,CHICANNA ECOVILLAGE,SA DE CV,,CARR ESCARCEGA CHETUMAL,KM 144,,XPUJIL,CALAKMUL,24640,,,Campeche,CHICANNA ECOVILLAGE  SA DE CV
541,GRECIA SA DE CV,,,PERIF KM 45418 TABLAJE 18820,18820,,POLIGONO TIXCACAL OP,MERIDA,97314,,,Yucatan,GRECIA  SA DE CV
542,EQUIPO LACTEOS DEL N,ORTE# S#A# DE C#V#,,KM# 15 CARR#CUAUHEMOC #COL# ALVARO OBREGON,124,,CIUDAD CUAUHTEMOC CENTRO,CUAUHTEMOC,31500,KM 14 CARR A ALVARO OBREG,KM 16 CARR A ALVARO OBREG,Chihuahua,EQUIPO LACTEOS DEL NORTE  SA DE CV
543,GRUPO GLOBAL DE NEGO,CIOS GML SA DE CV,,VIA BORELLI,210,A,FUENTES DEL VALLE,SAN PEDRO GARZA GARCIA,66220,VIA LACTEA,VIA SEPTEMBER,Nuevo Leon,GRUPO GLOBAL DE NEGOCIOS GML  SA DE CV
544,CORTES Y DOBLECES DE,ACAPULCO SA DE CV,,PRIV ALDAMA,2,,CAYACO,ACAPULCO DE JUAREZ,39905,FTE A LABORATORIOS,DI,Guerrero,CORTES Y DOBLECES DEACAPULCO  SA DE CV
545,AURUM COMERCIAL EMPR,ESARIAL SA DE CV,,BLVD HERMANOS SERDAN 45 PENTHOUSE,PISO 8,801,AMOR,PUEBLA,72140,33 NORTE,6 PONIENTE,Puebla,AURUM COMERCIAL EMPRESARIAL  SA DE CV
546,VIQUEZ INTERNACIONAL,#SA DE CV,,CAMINO REAL DE BUENAVISTA,50,,BUENAVISTA,ZUMPANGO,55600,RANCHO PALOMA,RANCHO BUENA VISTA,Estado de Mexico,VIQUEZ INTERNACIONAL SA DE CV
547,JSG TRANSPORTACION Y,LOGISTICA SA DE CV,,PABLO LIVAS,2300,L 3,TOLTECA,GUADALUPE,67170,,,Nuevo Leon,JSG TRANSPORTACION YLOGISTICA  SA DE CV
548,ELECMA INDUSTRIAL SA,DE CV,,ALFONSO REYES,3010,,BERNARDO REYES,MONTERREY,64280,,,Nuevo Leon,ELECMA INDUSTRIAL SA DE CV
549,FOR SA DE CV,,,TIHUATLAN,41,,SAN JERONIMO ACULCO,LA MAGDALENA CONTRERAS,10400,AVENIDA DE LAS FUENTES,BOULEVARD DE LA LUZ,CDMX,FOR  SA DE CV
550,CONSTRUCTORA YAXAR S,A DE CV,,EBANO,1607,,VILLAS DEL ALAMO,MINERAL DE LA REFORMA,42184,,,Hidalgo,CONSTRUCTORA YAXAR  SA DE CV
551,LOGISTICA DE SERVICI,OS INTEGRADOS DEL GO,LFO SA DE CV,GUERRERO,1 ALTOS,LOC 9,CENTRO,HUAUCHINANGO,73160,P JUAREZ,P ZARAGOZA,Puebla,LOGISTICA DE SERVICIOS INTEGRADOS DEL GOLFO  SA DE CV
552,SEMACOP SA DE CV,,,REVILLAGIGEDO,911,,FORMANDO HOGAR,VERACRUZ,91897,ESQ JP SILVA,CALLE,Veracruz,SEMACOP  SA DE CV
553,GARPABA SA DE CV,,,PSO DE LOS SICOMOROS,238,,ARBOLEDAS DE SAN JAVIER,PACHUCA DE SOTO,42084,PSO DE LOS FICUS,PRIV DE LOS GUNIPEROS,Hidalgo,GARPABA  SA DE CV
554,KISA IMPORTACIONES S,A DE CV,,FUENTE DE HERMES,6,SN,LOMAS DE TECAMACHALCO,NAUCALPAN DE JUAREZ,53950,FUENTE M LUISA,FUENTE DE MARCELA,Estado de Mexico,KISA IMPORTACIONES  SA DE CV
555,SERCOM DE COLIMA SA,DE CV,,AV TECNOLOGICO,35 A,,LOMAS VISTA HERMOSA,COLIMA,28010,,,Colima,SERCOM DE COLIMA  SA DE CV
556,COMERCIALIZADORA SED,ARI SA DE CV,,TEYOCOTITLA,188,7,FLORIDA,ALVARO OBREGON,1030,HORTENSIA,JUVENTINO ROSAS,CDMX,COMERCIALIZADORA SEDARI  SA DE CV
557,BISOLTEC DE MEXICO S,A DE CV,,SUR 75A,4309,1,VIADUCTO PIEDAD,IZTACALCO,8200,VIADUCTO,CORUA,CDMX,BISOLTEC DE MEXICO  SA DE CV
558,SISTEMA DE ENSE#ANZA,COMPUTACIONAL SA DE,CV,CEBORUCO,2511,1,REAL DE SAN JAVIER,METEPEC,52169,CALLE 123,CALLE  213,Estado de Mexico,SISTEMA DE ENSEANZACOMPUTACIONAL  SA DE CV
559,PRODUCCIONES ASFALTI,CAS SOLEDAD SA DE CV,,LUIS DONALDO COLOSIO,351,,SOLEDAD DE GRACIANO,SOLEDAD DE GRACIANO SANCHEZ,78430,MORELOS,15 DE  MAYO,San Luis Potosi,PRODUCCIONES ASFALTICAS SOLEDAD  SA DE CV
560,COMERCIALIZADORA ADI,SH S DE RL DE CV,,HECTOR ESPINOZA,208,########,ESCUADRON 201,IZTAPALAPA,9060,QWE,ASD,CDMX,COMERCIALIZADORA ADISH S DE RL DE CV
561,GRUPO RODARTE ESPINO,ZA SA DE CV,,CARR A NAVOLATO,8612,A,ALTOS DE BACHIGUALATO,CULIACAN,80130,UNO,DOS,Sinaloa,GRUPO RODARTE ESPINOZA  SA DE CV
562,TOYPOLIS SA DE CV,,,HOMERO,1425,105,POLANCO V SECCION,MIGUEL HIDALGO,11560,UNO,DOS,CDMX,TOYPOLIS  SA DE CV
563,COMERCIALIZADORA Y E,NVASADORA TYM SA DE,CV,REVOLUCION,122,,SAN JUAN CUAUTLANCINGO,CUAUTLANCINGO,72700,CORRECOR IND,CUAUTLANCINGO,Puebla,COMERCIALIZADORA Y ENVASADORA TYM  SA DE CV
564,COMERCIALIZADORA CAD,OS SA DE CV,,HUIXTLA,74,,LAS TORRES,TUXTLA GUTIERREZ,29045,AV TAPACHULA,AV YAJALON,Chiapas,COMERCIALIZADORA CADOS  SA DE CV
565,TRANSPORTES MAVA SA,DE CV,,AV BENITO JUAREZ,SN,########,BAHIA TORTUGAS SUR,MULEGE,23950,BENITO JUAREZ,SECTOR PURISIMA N,Baja California Sur,TRANSPORTES MAVA  SA DE CV
566,UNIDAD ESTRATEGICA D,E CONSTRUCCIONES SA,DE CV,LOMAS DE NAHUATZEN,11,C,LOMAS DE MORELIA,MORELIA,58210,LOK,LOK,Michoacan,UNIDAD ESTRATEGICA DE CONSTRUCCIONES  SA DE CV
567,REFACCIONARIA MODI S,A DE CV,,AV JUAREZ NORTE,126,B,EL PEDREGAL,TIZAYUCA,43802,FRANCISCO VILLA,SANTOS DEGOLLADO PROL ALD,Hidalgo,REFACCIONARIA MODI  SA DE CV
568,RADIADORES DINOS SA,DE CV,,HERREROS DE SAN FELIPE,792,,VASCO DE QUIROGA,MORELIA,58230,TZINTZUNTZAN,MUSICOS DE T,Michoacan,RADIADORES DINOS  SA DE CV
569,ALCASA COMERCIAL SA,DE CV,,NARDO,112,########,OBREGON,LEON,37320,27 DE SEPTIEMBRE,CAMELIA,Guanajuato,ALCASA COMERCIAL  SA DE CV
570,INTERCOMERCIAL ALCAS,A SA DE CV,,PRINCIPAL A SAN JUAN ABAJO,118,,SAN JUAN DE ABAJO,LEON,37684,BLVD HERMENEGILDO BU,PELETEROS,Guanajuato,INTERCOMERCIAL ALCASA  SA DE CV
571,CEPANCA CONSTRUCCION,ES SA DE CV,,ALBERTO TERRONES SUR,214,A,VICTORIA DE DURANGO,DURANGO,34000,NEGRETE,AV 20 DE NOVIEMBRE,Durango,CEPANCA CONSTRUCCIONES  SA DE CV
572,LARA VEGA SERVICIOS,INTEGRALES SA DE CV,,RETORNO DON JOSE,12ANEXO,B2 1,FRACC INSDUTRIAL BALVANERA,CORREGIDORA,76908,UNO,DOS,Queretaro,LARA VEGA SERVICIOS INTEGRALES  SA DE CV
573,FERRETERIA RROY SA D,E CV,,LOPEZ COTILLA,73,,STA PAULA,TONALA,45400,SAN JUAN,OBRERO,Jalisco,FERRETERIA RROY  SA DE CV
574,SSIGA SA DE CV,,,55,SN,,MIAMI,CARMEN,24115,SIN REFERENCIA,SIN REFERENCIA,Campeche,SSIGA  SA DE CV
575,INOXIDABLES Y MANUFA,CTURAS DE COAHUILA S,A DE CV,AV PRIMERA,632,,NAZARIO ORTIZ GARZA,SALTILLO,25110,ZEFERINO DMGZ,RAYMUNDO DEL BOSQUE,Coahuila,INOXIDABLES Y MANUFACTURAS DE COAHUILA  SA DE CV
576,"EDUTELSA,SA DE CV",,,PERIFERICO LUIS ECHEVERRIA,1560,PISO 10,GUANAJUATO ORIENTE,SALTILLO,25286,PRINCIPAL,CERRADA,Coahuila,"EDUTELSA, SA DE CV"
577,PROVEEDORA INDUSTRIA,L IRGO#SA DE CV,,PRIVADA ROBLE,1426,,FRACC LOS NOGALES,MONCLOVA,25730,PRINCIPAL,PRINCIPAL,Coahuila,PROVEEDORA INDUSTRIAL IRGO SA DE CV
578,DOS MS GENERAL DE CO,NSTRUCCIONES# SA DE,CV,SARA PEREZ DE MADERO,109,,FRANCISCO I MADERO,DURANGO,34159,#,#,Durango,DOS MS GENERAL DE CONSTRUCCIONES  SA DE CV
579,FLOCAR AUTOMOTRIZ DE,LOS ALTOS SA DE CV,,22 DE OCTUBRE,665,,COL LAS PALMAS,APATZINGAN,60699,CARRETERA,CARRETERA,Michoacan,FLOCAR AUTOMOTRIZ DELOS ALTOS  SA DE CV
580,"JR TRUKING,SA DE CV",,,JOSE MA MARTINEZ,1438,,TAMAZULA DE GORDIANO,TAMAZULA DE GORDIANO,49650,UNO,DOS,Jalisco,"JR TRUKING, SA DE CV"
581,TAE TRANSPORTES SA D,E CV,,ESTATAL LIBRE PENJAMO PASTOR ORTIZ,SIN NUM,,ESTACION PENJAMO,PENJAMO,36901,ESTACION,PENJAMO,Guanajuato,TAE TRANSPORTES  SA DE CV
582,CENTRO FERRETERO Y C,ONSTRUCTORA EL FENIX,SA DE CV,CARRETERA NACIONAL CHILPANCINGO CHILAPA,KM53,,LOS ANGELES,CHILAPA DE ALVAREZ,41100,NORTE,SUR,Guerrero,CENTRO FERRETERO Y CONSTRUCTORA EL FENIX SA DE CV
583,PROCESADORA DE ALIME,NTOS HIDALGO SA DE C,V,BLVD VALLE DE SAN JAVIER,101,1ER PISO,FRACC VALLE DE SAN J,PACHUCA DE SOTO,42086,AVENIDA RIO DE LAS AVENID,AVENIDA CUESCO,Hidalgo,PROCESADORA DE ALIMENTOS HIDALGO  SA DE CV
584,COMERCIALIZADORA CYN,US SA DE CV,,1RA CDA ESMERALDA,801,,MINERAL DE LA REFORMA,MINERAL DE LA REFORMA,42181,,,Hidalgo,COMERCIALIZADORA CYNUS  SA DE CV
585,CENTRAL PAPELERA TUL,ANCINGO#SA DE CV,,1RO DE MAYO ORIENTE,214,,TULANCINGO CENTRO,TULANCINGO DE BRAVO,43600,,,Hidalgo,CENTRAL PAPELERA TULANCINGO SA DE CV
586,CENTRO DE DIAGNOSTIC,O MEDICO PRISMA SA D,E CV,AVENIDA INSURGENTES,23,,CENTRO,IXMIQUILPAN,42300,HEROES DE CHAPULTEPEC,LA HUASTECA,Hidalgo,CENTRO DE DIAGNOSTICO MEDICO PRISMA  SA DE CV
587,DISTRIBUIDORA AVICOL,A TEXCAPA SA DE CV,,CARR MEXICO TUXP KM 100 500,1,,TEXCAPA,HUAUCHINANGO,73160,LOCALIDAD,TEXCAPA,Puebla,DISTRIBUIDORA AVICOLA TEXCAPA  SA DE CV
588,SIGMA MEXICO SA DE C,V,,ORIENTE 4,1020,,CIUDAD INDUSTRIAL,MORELIA,58200,D,X,Michoacan,SIGMA MEXICO  SA DE CV
589,GRUPO RIVERA LI#AN S,A DE CV,,RICARDO FLORES MAGON,201 T,,OAXACA CENTRO,OAXACA DE JUAREZ,68000,LAS CASAS,FLORES MAGON,Oaxaca,GRUPO RIVERA LIAN  SA DE CV
590,MATERIALES PARA CONS,TRUCCION SAN LORENZO,SA DE CV,JOSE MARIA MORELOS,44,,1RA SECCION,UNION HIDALGO,70150,5 DE MAYO,CORREGIDORA,Oaxaca,MATERIALES PARA CONSTRUCCION SAN LORENZO SA DE CV
591,"SURTIDORA DEL BAJIO,",SA DE CV,,AV COLINAS DEL CIMATARIO,426,,COLINAS DEL CIMATARI,QUERETARO,76090,AV CERRO DE LA SILLA,DOS,Queretaro,"SURTIDORA DEL BAJIO, SA DE CV"
592,GRUPO CORPORATIVO TE,CEPO SA DE CV,,AV JESUS GOYTORTUA,390,307,TANGAMANGA,SAN LUIS POTOSI,78269,L,,San Luis Potosi,GRUPO CORPORATIVO TECEPO  SA DE CV
593,NOMOBA INGENIERIA SA,DE CV,,AV DE LAS FUENTES,70,12,PARQUE INDUSTRIAL EL,EL MARQUES,76246,AV DE LAS FUENTES,AV DE LOS ARCOS,Queretaro,NOMOBA INGENIERIA SA DE CV
594,SOLUCIONES QUIMICAS,MESAL#SA DE CV,,CARRETERA ESTATAL 431KM 1 300,431KM 1,NAVE 9N,EL COLORADO,EL MARQUES,76246,PARQUE INDUSTRIAL BERNARD,DOS,Queretaro,SOLUCIONES QUIMICAS MESAL SA DE CV
595,ALSMITH Y ASOCIADOS,S DE RL DE CV,,BOULEVARD CENTRO SUR,98 PH,########,COLINAS DEL CIMATARIO,SANTIAGO DE QUERETARO,76090,CALLE,CALLE,Queretaro,ALSMITH Y ASOCIADOS S DE RL DE CV
596,EL TRIGAL AVIOS PARA,PANIFICACION SA DE,CV,PLAZA DE LA ESPERANZA,108,,PLAZA DEL SOL,QUERETARO,76099,PLAZA SAN JUAN DE LETRAN,PLAZA STA LUCIA B,Queretaro,EL TRIGAL AVIOS PARAPANIFICACION  SA DE CV
597,CENTER OF ENGINEERIN,G AND ADVANCED TECHN,OLOGY SA DE CV,AMADO NERVO,41,10,LOS ALCANFORES,QUERETARO,76150,EJIDO,EPIGMENIO GONZALEZ,Queretaro,CENTER OF ENGINEERING AND ADVANCED TECHNOLOGY  SA DE CV
598,SPIRIT 2 SPORTS CLUB,AND HOLISTIC SPA SA,DE CV,AV MAYAPAN MANZANA 4,LOTE 5C,Y 5 D,SMZA 21 CANCUN YAXCH,BENITO JUAREZ,77500,YAXCHILAN,MAYAPAN,Quintana Roo,SPIRIT 2 SPORTS CLUBAND HOLISTIC SPA  SA DE CV
599,PROMOTORA CONTINENTA,L DELTA# SA DE CV,,MONTE EVEREST,194,,CUMBRES,SAN LUIS POTOSI,78210,X,X,San Luis Potosi,PROMOTORA CONTINENTAL DELTA  SA DE CV
600,"JUAN DE DIOS, S DE R",L DE CV,,ANGEL FLORES,102,,CENTRO,ROSARIO,82800,,,Sinaloa,"JUAN DE DIOS, S DE RL DE CV"
601,EDIFICANDO ESPACIOS,SA DE CV,,PRIV RAFAEL BUELNA,5201,,BENITO JUAREZ,MAZATLAN,82180,UNO,DOS,Sinaloa,EDIFICANDO ESPACIOS  SA DE CV
602,MATERIALES Y FERRETE,RIA SANTA FE SA DE C,V,A GARCIA ABURTO,574,,CHOYAL,HERMOSILLO,83130,ESQUINA CON,ARTURO S HARO,Sonora,MATERIALES Y FERRETERIA SANTA FE  SA DE CV
603,I.D. GRAFICOS CREATI,VOS  SA DE CV,,ZACATECAS,144,,SAN BENITO,HERMOSILLO,83190,ESQ CUERNAVACA,NARANJO,Sonora,I.D. GRAFICOS CREATIVOS  SA DE CV
604,GARCA TU CASA LIMPIA,SA DE CV,,GANDARA,81,1,SAN BENITO,HERMOSILLO,83190,CAMPECHE,QUINTANA ROO,Sonora,GARCA TU CASA LIMPIA SA DE CV
605,MC SONORA RIVER SA D,E CV,,CALLE TEPUPA,15,SN,TEPUPA,NACOZARI DE GARCIA,84340,CALLE PINO SUAREZ,SIN NOMBRE,Sonora,MC SONORA RIVER  SA DE CV
606,RT DIESEL SERVICIOS,SA DE CV,,CDA SECT LOS MANGOS,SN,,BUENAVISTA RIO NVO 2DA SECC CD,CENTRO,86280,800 MTS DEL,RETEN,Tabasco,RT DIESEL SERVICIOS  SA DE CV
607,SURFACE TECHNOLOGY S,A DE CV,,PROLONGACION PASEO USUMACINTA,SN,LOCAL 34,BOSQUES DE SALOYA,NACAJUCA,86220,FLOR DEL TROPICO,VICENTENARIO,Tabasco,SURFACE TECHNOLOGY  SA DE CV
608,WORLD REGISTER SA DE,CV,,PRIVADA PASEO DEL MACUILIS,INTERIOR,112,PASEOS DEL USUMACINTA,CENTRO,86035,AV PROL PASEO USUMACINTA,27 DE FEBRERO,Tabasco,WORLD REGISTER SA DE CV
609,ELECTRIFICACIONES Y,CATODICA DEL SUR SA,DE CV,FRANCISCO I MADERO,607,,CARDENAS CENTRO,CARDENAS,86500,XICOTENCATL,IGNACIO COMONFORT,Tabasco,ELECTRIFICACIONES Y CATODICA DEL SUR  SA DE CV
610,ACCESORIOS DE CALIDA,D DE TAMPICO SA DE C,V,MORAL,113,,ALTAVISTA,TAMPICO,89240,NARANJO,AV HIDALGO,Tamaulipas,ACCESORIOS DE CALIDAD DE TAMPICO  SA DE CV
611,ORCA DESARROLLO INTE,GRAL SA DE CV,,PRIV 1A,109,,GUSTAVO DIAZ ORDAZ,TAMPICO,89108,AV UNIV SUR,AV UNIV PTE,Tamaulipas,ORCA DESARROLLO INTEGRAL  SA DE CV
612,GRUPO COPALS SA DE C,V,,3A,108,,SAHOP,CIUDAD MADERO,89506,,,Tamaulipas,GRUPO COPALS  SA DE CV
613,DIGITAL GALAXY DE ME,XICO SA DE CV,,LOMA AZUL,207,,LOMA DE ROSALES,TAMPICO,89100,,,Tamaulipas,DIGITAL GALAXY DE MEXICO  SA DE CV
614,"GRUPO TLAXCALLAN,S D",E RL DE CV,,AV LUIS NAVA,906,A,EL CARMEN,APIZACO,90338,JESUS CARRANZA,FCO SARABIA,Tlaxcala,"GRUPO TLAXCALLAN,S DE RL DE CV"
615,NEOQUARCS SA DE CV,,,CERRADA DE PRADERA,9,,DOS VISTAS LAS ANIMAS,XALAPA,91190,AGUA DULCE,SABANA,Veracruz,NEOQUARCS  SA DE CV
616,AGROPECUARIA EL ZAPO,TE#SA DE CV,,5 DE MAYO,97,,TEOCELO,TEOCELO,91615,1,ARISTA,Veracruz,AGROPECUARIA EL ZAPOTE SA DE CV
617,RIZZO MULTIMEDIOS SA,DE CV,,LEONA VICARIO,8,,XALAPA ENRIQUEZ CENTRO,XALAPA,91000,ESQ,,Veracruz,RIZZO MULTIMEDIOS SA DE CV
618,"LA FUERZA DEL VINO,",S#A# DE C#V#,,AV 9 NUM,1803,,SAN JOSE,CORDOBA,94560,CALLE 18,CALLE 20,Veracruz,"LA FUERZA DEL VINO,  SA DE CV"
619,TRANSPORTES FONZA SA,DE CV,,KM 14 CARRETERA FEDERAL CORDOBA VERACRUZ,SN,,EL POCHOTE,YANGA,94930,DESVIACION A OMEALCA,PRIIPAL,Veracruz,TRANSPORTES FONZA SA DE CV
620,INTROCOMPEZ S DE RL,DE CV,,AVENIDA PROLONGACION EJE 6 SUR,560,D18,SAN JOSE,IZTAPALAPA,9000,D17,D19,CDMX,INTROCOMPEZ S DE RL DE CV
621,ITALMEX IMPORTADORA,Y DISTRIBUIDORA#SA D,E CV,PONIENTE 7,836,,CENTRO,ORIZABA,94300,JUNTO,AL AUDITORIO METROPOLITAN,Veracruz,ITALMEX IMPORTADORA Y DISTRIBUIDORA SA DE CV
622,INMOBILIARIA PROFESI,ONAL DE ORIZABA# SA,DE CV,ORIENTE 10,689,,CENTRO,ORIZABA,94300,SUR 17,SUR 19,Veracruz,INMOBILIARIA PROFESIONAL DE ORIZABA  SA DE CV
623,METALMECANICA INDUST,RIAL CAMACHO  SA DE,CV,CALLE 1 DE MAYO,116,,SANTA CRUZ BUENAVISTA,CORDOBA,94690,ALDAMA,MADERO,Veracruz,METALMECANICA INDUSTRIAL CAMACHO  SA DE CV
624,TECNIPRODUCTOS ORIZA,BA#SA DE CV,,CALLE 7,557,,RAFAEL ALVARADO,ORIZABA,94340,AVENIDA 6,AVENIDA 7,Veracruz,TECNIPRODUCTOS ORIZABA SA DE CV
625,PERFORACIONES REHABI,LITACIONES Y AFOROS,DE POZOS SA DE CV,AV JOSE CARDEL NTE,47,,JOSE CARDEL CENTRO,LA ANTIGUA,91680,HILARIO GALLO,M P,Veracruz,PERFORACIONES REHABILITACIONES Y AFOROS DE POZOS  SA DE CV
626,MATERIALES GARCA SA,DE CV,,CALLE 73,542,,MERIDA CENTRO,MERIDA,97000,CALLE 68,CALLE 70,Yucatan,MATERIALES GARCA  SA DE CV
627,INDUSTRIAS GORI SA D,E CV,,59,390,DPT1ALTO,MERIDA CENTRO,MERIDA,97000,,,Yucatan,INDUSTRIAS GORI  SA DE CV
628,COPIERS SA DE CV,,,CALLE 59 BAJOS,390,1,MERIDA CENTRO,MERIDA,97000,X  42,Y 44,Yucatan,COPIERS  SA DE CV
629,SERVICIOS BIOMEDICOS,DEL SU RESTE#SA DE,CV,CALLE 21,212,PA,SAN MIGUEL,MERIDA,97140,16,18,Yucatan,SERVICIOS BIOMEDICOSDEL SU RESTE SA DE CV
630,MATERIALES DE LA PEN,INSULA SA DE CV,,1 AVENIDA MARCELINO CHAMPAGNAT,200,DEPTO 1,JUAN B SOSA,MERIDA,97205,20B,,Yucatan,MATERIALES DE LA PENINSULA  SA DE CV
631,IMPORTADORA Y COMERC,IALIZADORA PEME SA D,E CV,CALLE 33B,506,,MERIDA CENTRO,MERIDA,97000,C 62,C 62 A,Yucatan,IMPORTADORA Y COMERCIALIZADORA PEME  SA DE CV
632,IRRIGACION Y OBRAS H,IDRAULICAS SA DE CV,,CARR ZACATECAS FRESNILLO,KM 16,,ENTRONQUE CARR ZACATECAS SALTI,MORELOS,98100,CARPATOS,GARCIA SALINAS,Zacatecas,IRRIGACION Y OBRAS HIDRAULICAS  SA DE CV
633,COMERCIALIZADORA PIM,ER SA DE CV,,GONZALEZ ORTEGA NTE,667,,TORREON CENTRO,TORREON,27000,ALDAMA,GUERRERO,Coahuila,COMERCIALIZADORA PIMER  SA DE CV
634,IQ LAGUNA  SA DE CV,,,AVENIDA RIO DANUBIO,901,,LA ESTRELLA,TORREON,27010,UNO,DOS,Coahuila,IQ LAGUNA  SA DE CV
635,"POLIFORMAS,SA DE CV",,,CALLE MEXICO ESQ MELCHOR OCAMPO,S#N,,PLAN DE AYALA,TIHUATLAN,92912,MELCHOR OCAMPO,PRIVADA MEXICO,Veracruz,"POLIFORMAS, SA DE CV"
636,YPSILON INGENIERIA S,A DE CV,,SANTA ELENA,1501,C,SANTA ELENA,POZA RICA DE HIDALGO,93240,CALLE 26,POZO 120,Veracruz,YPSILON INGENIERIA  SA DE CV
637,COMPA#IA CONSTRUCTOR,A QUANTUM SA DE CV,,CALLE 3,101,,BENITO JUAREZ,POZA RICA DE HIDALGO,93310,BLVD RUIZ CORTINEZ,AVE 1,Veracruz,COMPAIA CONSTRUCTORA QUANTUM  SA DE CV
638,CONSTRUCCIONES SANTA,CLARA#SA DE CV,,CALLE CIRUELOS,15,,EL CAPULIN,BANDERILLA,91306,CARRETERA FED MEXICOVER,CEREZOS KM 45,Veracruz,CONSTRUCCIONES SANTACLARA SA DE CV
639,GRUPO MUEBLERO COMER,CIAL OZULUAMA SA DE,CV,MORELOS,5,,CENTRO,OZULUAMA DE MASCARE#AS,92080,MORELOS,OCAMPO,Veracruz,GRUPO MUEBLERO COMERCIAL OZULUAMA  SA DE CV
640,CONSTRUCTORA ELEC. Y,CIVIL MAVE SA DE CV,,FELIPE CHAVEZ,102,,SAN LORENZO TEPALTITLAN,TOLUCA,50010,UNO,DOS,Estado de Mexico,CONSTRUCTORA ELEC. YCIVIL MAVE  SA DE CV
641,EL MEJOR PAN DE TOLU,CA#SA DE CV,,JUAREZ SUR,204,,CENTRO,TOLUCA,50000,MORELOS,INSTITUTO LITERARIO,Estado de Mexico,EL MEJOR PAN DE TOLUCA SA DE CV
642,DECORACION Y MANUALI,DADES LAS ROSAS#SA D,E CV,1 DE MAYO,103,,CENTRO,TOLUCA,50000,JUAREZ,RAYON,Estado de Mexico,DECORACION Y MANUALIDADES LAS ROSAS SA DE CV
643,"MM MEX,SA DE CV",,,HERIBERTO ENRIQUEZ,703,1ER PISO,EMILIANO ZAPATA,TOLUCA,50190,MORELOS,HIDALGO,Estado de Mexico,"MM MEX, SA DE CV"
644,LITE ASESORES MEXICO,SA DE CV,,JUAREZ,205,,AMATEPEC,AMATEPEC,51517,CENTRO,CENTRO,Estado de Mexico,LITE ASESORES MEXICO SA DE CV
645,COMERCIALIZADORA OSC,AR IN PEPES SA DE CV,,CLL 2 DE NOVIEMBRE,S N,,COL CENTRO,IXTLAHUACA,50740,TIENDA DE,ABARROTES,Estado de Mexico,COMERCIALIZADORA OSCAR IN PEPES  SA DE CV
646,R1 COMUNICACIONES S,DE RL DE CV,,BLV AGUACALIENTE,9333,LOCAL 2F,MADERO,TIJUANA,22040,JALISCO,GUANAJUATO,Baja California,R1 COMUNICACIONES S DE RL DE CV
647,VINYL WINDOWS INNOVA,TION  SA DE CV,,PLOMO,1231,,LOS ALAMOS,TIJUANA,22110,DIAMANTE,ZAFIRO,Baja California,VINYL WINDOWS INNOVATION  SA DE CV
648,IMPORTACIONES Y NOVE,DADES CALAFIA DE TIJ,UANA SA DE CV,PASEO DEL PEDREGAL,354,106,PLAYAS DE TIJUANA SECC TERRAZA,TIJUANA,22504,PASEO ENSENADA,PASEO PLAYAS,Baja California,IMPORTACIONES Y NOVEDADES CALAFIA DE TIJUANA  SA DE CV
649,AVILEY INGENIERIA SA,DE CV,,HACIENDA SANTA VERONICA,10219,Q20,HACIENDA CASA GRANDE,TIJUANA,22244,HACIENDA,SANTA MARIA,Baja California,AVILEY INGENIERIA SA DE CV
650,CONDUCCIONES Y CIMEN,TACIONES DOEG SA DE,CV,E ZAPATA ED A,D 203,,MANUEL AVILA CAMACHO,COATZACOALCOS,96420,INDEPENDENCIA,MATAMOROS,Veracruz,CONDUCCIONES Y CIMENTACIONES DOEG  SA DE CV
651,CODEAL SA DE CV,,,CENTENARIO,809,,SAN MIGUEL,LEON,37390,UNO,DOS,Guanajuato,CODEAL  SA DE CV
652,SHEIDAR CONSTRUCCION,ES SA DE CV,,1 DE MAYO E AMERICA Y RIO BRAV,412,,VALLE HERMOSO CENTRO,VALLE HERMOSO,87500,,,Tamaulipas,SHEIDAR CONSTRUCCIONES  SA DE CV
653,N ANGUS ALIMENTOS SA,DE CV,,CALLE VERACRUZ,520,,SANTA MARIA LA RIBER,TUXTLA GUTIERREZ,29070,,,Chiapas,N ANGUS ALIMENTOS SA DE CV
654,SURCOS DE CHIAPAS  S,A DE CV,,12 PONIENTE SUR,1724,1,CENTRO,TUXTLA GUTIERREZ,29000,CHIAPAS,OAXACA,Chiapas,SURCOS DE CHIAPAS  SA DE CV
655,COMERCIAL YENY SA DE,CV,,AV BELISARIO DOMINGUEZ,29,,CENTRO,PALENQUE,29960,ALDAMA,ALLENDE,Chiapas,COMERCIAL YENY SA DE CV
656,SERVICIOS DE GESTORI,A Y ASESORIA SA DE C,V,AV 20 NOVIEMBRE,SN,,CENTRO,PALENQUE,29960,,,Chiapas,SERVICIOS DE GESTORIA Y ASESORIA  SA DE CV
657,EMPACADORA FRUVETI S,#A# DE C#V#,,LA BASTIDA,50,F,CAMERINO GARCIA,ZAMORA,59620,JUAREZ,FERROCARRIL,Michoacan,EMPACADORA FRUVETI  SA DE CV
